{"$schema":"https://json-schema.org/draft/2020-12/schema","$id":"https://github.com/jawa-dam/GEI-Research/blob/main/schema/comparison.schema.json","title":"GEI Comparison Record","type":"object","additionalProperties":false,"required":["id","type","title","status","version","comparison_type","subjects"],"properties":{"id":{"type":"string","pattern":"^CMP-[A-Z0-9-]+$"},"type":{"const":"comparison"},"title":{"type":"string","minLength":1},"status":{"type":"string","enum":["draft","active","deprecated"]},"version":{"type":"string","pattern":"^\\d+\\.\\d+\\.\\d+$"},"comparison_type":{"type":"string","enum":["structural","functional","symbolic","linguistic","technological","chronological","geographic","cultural_transmission","independent_convergence","unknown_relationship"]},"subjects":{"type":"array","minItems":2,"items":{"type":"string"}},"similarity":{"type":"string"},"difference":{"type":"string"},"relationship_claim":{"type":"string"},"source_ids":{"type":"array","items":{"type":"string","pattern":"^SRC-[A-Z0-9-]+$"}},"evidence_ids":{"type":"array","items":{"type":"string","pattern":"^EVD-[A-Z0-9-]+$"}},"interpretation_ids":{"type":"array","items":{"type":"string","pattern":"^INT-[A-Z0-9-]+$"}},"confidence":{"type":"string","enum":["C0","C1","C2","C3","C4","C5"]},"alternative_explanations":{"type":"array","items":{"type":"string"}},"notes":{"type":"string"}}}