{"id":"CMP-GEN-MES-001","type":"comparison","title":"Waters and Cosmic Ordering: Genesis and Enuma Elish","status":"draft","version":"1.0.0","comparison_type":"structural","subjects":["COS-GEN-001","COS-MES-001","COS-MES-002"],"similarity":"Both traditions place watery realities near the beginning of a cosmic sequence and include subsequent ordering of the cosmos.","difference":"The identities, narrative structures, divine conflicts, and mechanisms of ordering differ substantially.","relationship_claim":"Comparative similarity only; no historical dependence is asserted.","source_ids":[],"evidence_ids":[],"interpretation_ids":[],"confidence":"C1","alternative_explanations":["Independent convergence","Shared ancient Near Eastern environment","Different literary and theological frameworks"],"notes":"Requires careful dating, textual comparison, and transmission analysis."}