{"id":"CMP-GEN-GRC-001","type":"comparison","title":"Cosmic Ordering: Genesis and Greek Theogony","status":"draft","version":"1.0.0","comparison_type":"structural","subjects":["TXT-GEN-001","TXT-GRC-001"],"similarity":"Both traditions contain ordered relationships among cosmic elements and divine or creative processes.","difference":"Genesis 1 presents a sequential creation account centered on divine speech and separation, while Hesiod's Theogony emphasizes genealogy and divine succession.","relationship_claim":"Comparative similarity only; no historical dependence is asserted.","source_ids":[],"evidence_ids":[],"interpretation_ids":[],"confidence":"C1","alternative_explanations":["Independent convergence","Shared ancient Mediterranean conceptual patterns","Different literary purposes"],"notes":"Requires passage-level comparison."}