{"id":"CMP-GEN-EGY-001","type":"comparison","title":"Primordial Waters: Genesis and Egyptian Tradition","status":"draft","version":"1.0.0","comparison_type":"structural","subjects":["COS-GEN-001","COS-EGY-001"],"similarity":"Both records describe a watery condition associated with the beginning of a creation sequence.","difference":"Genesis 1 and the Heliopolitan tradition organize and characterize their cosmologies differently and arise from distinct textual traditions.","relationship_claim":"Comparative similarity only; no historical dependence is asserted.","source_ids":[],"evidence_ids":[],"interpretation_ids":[],"confidence":"C1","alternative_explanations":["Independent convergence","Shared ancient Near Eastern conceptual environment","Superficial structural similarity"],"notes":"Requires source-level comparison before stronger claims are made."}